{
  "$schema": "https://example.invalid/ai-migration-framework/schemas/migration-config.schema.json",
  "schema_version": "2.0",
  "framework_version": "3.1.0",
  "profiles": {
    "source": "cpp",
    "target": "java-25",
    "pair": "cpp-to-java-25"
  },
  "output_profile": "service",
  "migration_strategy": "incremental",
  "source_root": "./src",
  "target_root": "./app",
  "quality_gates": {
    "required_checks": ["behavioral-contracts", "build", "tests"],
    "coverage": {
      "metric": "changed-code",
      "threshold_percent": null,
      "rationale": "Set a project risk-based threshold before validation"
    }
  },
  "project_decisions": {},
  "validation_status": "unvalidated"
}
